{
  "id": "sfx.pencil",
  "version": "1.0.0",
  "kind": "sfx",
  "status": "published",
  "title": "Pencil scratch",
  "description": "Short scratch under a draw-on. Integrated loudness -28.0 LUFS.",
  "files": [
    {
      "path": "pencil.wav",
      "role": "audio"
    }
  ],
  "implementation": {
    "kit_component": "Audio",
    "props": {},
    "deterministic_inputs": [
      "tools/gen_audio.py:sfx.pencil",
      "seed=103"
    ]
  },
  "provenance": {
    "source": "code",
    "author": "video-style/tools/gen_audio.py",
    "created": "2026-10-27",
    "tool": "numpy+soundfile",
    "seed": 103
  },
  "license": "CC0-1.0",
  "tags": [
    "audio",
    "pulse"
  ]
}
