{
  "id": "template.alphabet",
  "version": "1.0.0",
  "kind": "template",
  "status": "published",
  "title": "Alphabet strip",
  "description": "A reference list (Latin / Greek / symbols) as small tiles; hops draw 'one step right in THIS list' arcs in thread colour.",
  "files": [],
  "implementation": {
    "kit_component": "diagrams/alphabet",
    "props": {},
    "deterministic_inputs": [
      "element props",
      "element seed",
      "local frame"
    ]
  },
  "style": {
    "roles": [
      "ink",
      "bg",
      "thread"
    ],
    "modes": [
      "paper",
      "night"
    ],
    "cadence": "ones"
  },
  "provenance": {
    "source": "hand-made",
    "author": "MAI style system (Claude Code session)",
    "created": "2026-10-27",
    "reference": "Built for the 'analogy → ARC' explainer (Mitchell et al. papers)"
  },
  "license": "CC0-1.0",
  "tags": [
    "diagram"
  ]
}
