{
  "id": "template.arc",
  "version": "1.0.0",
  "kind": "template",
  "status": "published",
  "title": "ARC task",
  "description": "Demonstration pairs + test input on the ARC data palette; digitsAt cross-fades to integer codes (textual modality); bad shows a malformed answer.",
  "files": [],
  "implementation": {
    "kit_component": "diagrams/arc",
    "props": {},
    "deterministic_inputs": [
      "element props",
      "element seed",
      "local frame"
    ]
  },
  "style": {
    "roles": [
      "ink",
      "guide",
      "data.arc",
      "concept-1",
      "concept-3"
    ],
    "modes": [
      "paper",
      "night"
    ],
    "cadence": "ones"
  },
  "provenance": {
    "source": "hand-made",
    "author": "MAI style system (Claude Code session)",
    "created": "2026-10-27",
    "reference": "Built for the 'analogy → ARC' explainer (Mitchell et al. papers)"
  },
  "license": "CC0-1.0",
  "tags": [
    "diagram"
  ]
}
