{
  "id": "vo.the-thread-dialogue",
  "version": "1.0.0",
  "kind": "vo",
  "status": "published",
  "title": "Dialogue VO: Why do some videos pull you in?",
  "description": "Two-voice dialogue (curious mode) generated by tools/dialogue.py; mixed and normalised to -16 LUFS. Lines are frozen individually under lines/.",
  "files": [
    {
      "path": "dialogue.wav",
      "role": "audio"
    },
    {
      "path": "lines/guide-0aad64136e3edf06.wav",
      "role": "source"
    },
    {
      "path": "lines/guide-28a23a929669a184.wav",
      "role": "source"
    },
    {
      "path": "lines/guide-6c5b09f61da2ccbb.wav",
      "role": "source"
    },
    {
      "path": "lines/guide-6f2729d7c3c43b94.wav",
      "role": "source"
    },
    {
      "path": "lines/guide-9db588cd2020d15c.wav",
      "role": "source"
    },
    {
      "path": "lines/guide-b30464d81cda447e.wav",
      "role": "source"
    },
    {
      "path": "lines/guide-b9046f6363ab4027.wav",
      "role": "source"
    },
    {
      "path": "lines/guide-ba7ccddd764c2766.wav",
      "role": "source"
    },
    {
      "path": "lines/sam-3dbb3383d3e61e9a.wav",
      "role": "source"
    },
    {
      "path": "lines/sam-3e65e96a2cbce6f7.wav",
      "role": "source"
    },
    {
      "path": "lines/sam-6543be9e15076557.wav",
      "role": "source"
    },
    {
      "path": "lines/sam-73a3f45011528393.wav",
      "role": "source"
    },
    {
      "path": "lines/sam-7efe718f2c50e806.wav",
      "role": "source"
    },
    {
      "path": "lines/sam-c5fdcfe1069985d5.wav",
      "role": "source"
    },
    {
      "path": "lines/sam-daf825f292fc146f.wav",
      "role": "source"
    },
    {
      "path": "lines/sam-fc655b37fe561092.wav",
      "role": "source"
    }
  ],
  "provenance": {
    "source": "generated",
    "author": "tools/dialogue.py",
    "created": "2026-10-27",
    "tool": "piper-tts",
    "model": "guide=voice.joe@1.0.0, sam=voice.alba@1.0.0",
    "prompt": "storyboard lines (see storyboards/the-thread-dialogue.yaml)",
    "notes": "Stochastic TTS: each line generated once and frozen; never regenerated at render time."
  },
  "license": "Inherits voice licences: CC0-1.0 (dataset: NabuCasa voice-datasets); Piper model MIT; CC-BY-4.0 (dataset: Edinburgh DataShare 10283/3270, credit 'alba'); Piper model MIT",
  "tags": [
    "vo",
    "dialogue"
  ]
}
