{
  "id": "texture.watercolor",
  "version": "1.0.0",
  "kind": "texture",
  "status": "published",
  "title": "Watercolour wash",
  "description": "Fill treatment: role colour at wash opacity, edge-displaced with low-frequency turbulence and offset so it misses the ink line (the 'printed slightly off-register' look).",
  "files": [],
  "implementation": {
    "kit_component": "InkShape",
    "props": {
      "wash": true
    },
    "deterministic_inputs": [
      "element seed",
      "tokens/texture.tokens.json"
    ]
  },
  "style": {
    "modes": [
      "paper",
      "night"
    ]
  },
  "provenance": {
    "source": "code",
    "author": "MAI style system (Claude Code session)",
    "created": "2026-10-27"
  },
  "license": "CC0-1.0",
  "tags": [
    "texture"
  ]
}
