{
  "id": "template.codelets",
  "version": "1.0.0",
  "kind": "template",
  "status": "published",
  "title": "Codelet swarm",
  "description": "Seeded ant-like agents; wander amplitude follows temperature keys and they settle on targets as T falls.",
  "files": [],
  "implementation": {
    "kit_component": "diagrams/codelets",
    "props": {},
    "deterministic_inputs": [
      "element props",
      "element seed",
      "local frame"
    ]
  },
  "style": {
    "roles": [
      "ink"
    ],
    "modes": [
      "paper",
      "night"
    ],
    "cadence": "ones"
  },
  "provenance": {
    "source": "hand-made",
    "author": "MAI style system (Claude Code session)",
    "created": "2026-10-27",
    "reference": "Built for the 'analogy → ARC' explainer (Mitchell et al. papers)"
  },
  "license": "CC0-1.0",
  "tags": [
    "diagram"
  ]
}
