{
  "id": "sfx.ripple-ping",
  "version": "1.0.0",
  "kind": "sfx",
  "status": "published",
  "title": "Ripple ping",
  "description": "Glassy ping that accompanies a motif ripple (when the idea is named). Integrated loudness -26.0 LUFS.",
  "files": [
    {
      "path": "ping.wav",
      "role": "audio"
    }
  ],
  "implementation": {
    "kit_component": "Audio",
    "props": {},
    "deterministic_inputs": [
      "tools/gen_audio.py:sfx.ripple-ping",
      "seed=102"
    ]
  },
  "provenance": {
    "source": "code",
    "author": "video-style/tools/gen_audio.py",
    "created": "2026-10-27",
    "tool": "numpy+soundfile",
    "seed": 102
  },
  "license": "CC0-1.0",
  "tags": [
    "audio",
    "pulse"
  ]
}
